artist,title,album,lyrics,lyrics_length
The Beatles,Yesterday,The Beatles (The Original Studio Recordings),"Yesterday
All my troubles seemed so far away
Now it looks as though they're here to stay
Oh, I believe in yesterday

Suddenly
I'm not half the man I used to be
There's a shadow hanging over me
Oh, yesterday came suddenly

Why she had to go
I don't know, she wouldn't say
I said something wrong
Now I long for yesterday

Yesterday
Love was such an easy game to play
Now I need a place to hide away
Oh, I believe in yesterday

Why she had to go
I don't know, she wouldn't say
I said something wrong
Now I long for yesterday

Yesterday
Love was such an easy game to play
Now I need a place to hide away
Oh, I believe in yesterday

Mmm-mmm-mmm-mmm-mmm, hmm-hmm",128
The Beatles,In My Life,The Beatles (The Original Studio Recordings),"There are 
places I remember
All my life, though some have changed (
Ooh, ooh, ooh
)
Some forever, not for better
Some have gone and some remain (Ooh, ooh, ooh)

All these places had their moments
With lovers and friends, I still can recall
Some are 
dead and some are living
In my life, I've loved them all

But of 
all these friends and lovers
There is no one compares with you (
Ooh, ooh, ooh
)
And these 
memories lose their meaning
When I think of love as something new (
Ooh, ooh, ooh
)

Though I 
know I'll never lose affection
For people and things that went before
I know I'll often stop and think about them
In my life, I love you more


Though I 
know I'll never lose affection
For people and things that went before
I know I'll often stop and think about them
In my life, I love you more

In my life, I love you more",164
The Beatles,Let It Be,The Beatles (The Original Studio Recordings),"When I find myself in times of trouble
Mother Mary comes to me
Speaking words of wisdom
Let it be
And in my hour of darkness
She is standing right in front of me
Speaking words of wisdom
Let it be

Let it be, let it be
Let it be, let it be
Whisper words of wisdom
Let it be

And when the broken-hearted people
Living in the world agree
There will be an answer
Let it be
For though they may be parted
There is still a chance that they will see
There will be an answer
Let it be

Let it be, let it be
Let it be, let it be
Yeah, there will be an answer
Let it be
Let it be, let it be
Let it be, let it be
Whisper words of wisdom
Let it be


Let it be, let it be
Let it be, yeah, let it be
Whisper words of wisdom
Let it be

And when the night is cloudy
There is still a light that shines on me
Shine until tomorrow
Let it be
I wake up to the sound of music
Mother Mary comes to me
Speaking words of wisdom
Let it be, yeah

Let it be, let it be
Let it be, yeah, let it be
Oh, there will be an answer
Let it be
Let it be, let it be
Let it be, yeah, let it be
Oh, there will be an answer
Let it be
Let it be, let it be
Let it be, yeah, let it be
Whisper words of wisdom
Let it be",267
The Beatles,Hey Jude,The Beatles (The Original Studio Recordings),"Hey, Jude, don't make it bad
Take a sad song and make it better
Remember to let her into your heart
Then you can start to make it better

Hey, Jude, don't be afraid
You were made to go out and get her
The minute you let her under your skin
Then you begin to make it better

And anytime you feel the pain, hey, Jude, refrain
Don't carry the world upon your shoulders
For well you know that it's a fool who plays it cool
By making his world a little colder
Na-na-na-na-na, na-na-na-na

Hey, Jude, don't let me down
You have found her, now go and get her
(Let it out and let it in)
Remember (Hey, Jude) to let her into your heart
Then you can start to make it better

So let it out and let it in, hey, Jude, begin
You're waiting for someone to perform with
And don't you know that it's just you, hey, Jude, you'll do
The movement you need is on your shoulder
Na-na-na-na-na, na-na-na-na, yeah

Hey, Jude, don't make it bad
Take a sad song and make it better
Remember to let her under your skin
Then you'll begin to make it (
Woah, fucking hell
)
Better, better, better, better, better, better, oh

Yeah, yeah-yeah-yeah-yeah-yeah-yeah
Na-na-na-na-na-na-na, na-na-na-na, hey, Jude
Na-na-na-na-na-na-na, na-na-na-na, hey, Jude
Na-na-na-na-na-na-na, na-na-na-na, hey, Jude
Na-na-na-na-na-na-na, na-na-na-na, hey, Jude
(Jude, Judy, Judy, Judy, Judy, Judy, ow-wow)
Na-na-na-na-na-na-na (Na-na-na), na-na-na-na, hey, Jude
(Jude, Jude, Jude, Jude, Jude)
Na-na-na-na-na-na-na (Yeah, yeah, yeah), na-na-na-na, hey, Jude
(You know you can make, Jude, Jude, you're not gonna break it)
Na-na (Don't make it bad, Jude) na-na-na-na-na (Take a sad song and make it better), na-na-na-na, hey, Jude
Hey, Jude, hey, Jude wow
Na-na-na-na-na-na-na, na-na-na-na, hey, Jude
Na-na-na-na-na-na-na, na-na-na-na, hey, Jude
Jude, Jude, Jude, Jude, Jude, Jude
Na-na-na-na-na-na-na, na-na-na-na, hey, Jude
Na-na-na-na-na-na-na, na-na-na-na, hey, Jude
(Na-na-na-na-na-na-na-na-na-na-na-na)
Na-na-na-na-na-na-na, na-na-na-na, hey, Jude
Na-na-na-na-na-na-na, na-na-na-na, hey, Jude
Na-na-na-na-na-na-na (Make it, Jude), na-na-na-na, hey, Jude
(Yeah-yeah-yeah-yeah, yeah, yeah, yeah)
Na-na-na-na-na-na-na, na-na-na-na, hey, Jude
(Go listen to ya ma-ma-ma-ma-ma-ma-ma-ma)
Na-na-na-na-na-na-na, na-na-na-na, hey, Jude
Na-na-na-na-na-na-na, na-na-na-na, hey, Jude",350
The Beatles,Come Together,The Beatles (The Original Studio Recordings),"Shoot me
Shoot me
Shoot me
Shoot me

Here come old flat-top, he come grooving up slowly
He got ju-ju eyeball, he one holy roller
He got hair down to his knee
Got to be a joker, he just do what he please

Shoot me
Shoot me
Shoot me
Shoot me

He wear no shoeshine, he got toe-jam football
He got monkey finger, he shoot Coca-Cola
He say, ""I know you, you know me""
One thing I can tell you is you got to be free

Come together right now
Over me

Shoot me
Shoot me
Shoot me
Shoot me

He bag production, he got walrus gumboot
He got Ono sideboard, he one spinal cracker
He got feet down below his knee
Hold you in his armchair, you can feel his disease

Come together right now
Over me

Shoot me
Right
Come, come, come, come, come

He roller-coaster, he got early warnin'
He got muddy water, he one mojo filter
He say, ""One and one and one is three""
Got to be good-lookin', 'cause he's so hard to see

Come together right now
Over me

Shoot me
Shoot me
Shoot me
Oh

Come together, yeah
Come together, yeah
Come together, yeah
Come together, yeah
Come together, yeah
Come together, yeah
Come together, yeah
Oh
Come together, yeah
Come together, yeah",220
The Beatles,Here Comes the Sun,The Beatles (The Original Studio Recordings),"[Chorus: George Harrison, 
George Harrison & Paul McCartney
]
Here comes the sun, doo-d-doo-doo
Here comes the sun
And I say, 
""It's alright""

Little darling
It's been a long, cold, lonely winter
Little darling
It feels like years since it's been here

Here comes the sun, doo-d-doo-doo
Here comes the sun
And I say,
 ""It's alright""

Little darling
The smile's returning to the faces
Little darling
It seems like years since it's been here

Here comes the sun
Here comes the sun
And I say, ""It's alright""

Sun, sun, sun, here it comes
Sun, sun, sun, here it comes
Sun, sun, sun, here it comes
Sun, sun, sun, here it comes
Sun, sun, sun, here it comes

Little darling
I feel that ice is slowly melting
Little darling
It seems like years since it's been clear

But
 here comes the sun, doo-d-doo-doo
Here comes the sun
And I say,
 ""It's alright""
Here comes the sun, doo-d-doo-doo
Here comes the sun
It's alright
It's alright",164
The Beatles,Eleanor Rigby,The Beatles (The Original Studio Recordings),"Ah, look at all the lonely people
Ah, look at all the lonely people

Eleanor Rigby
Picks up the rice in the church where a wedding has been
Lives in a dream
Waits at the window
Wearing the face that she keeps in a jar by the door
Who is it for?

All the lonely people
Where do they all come from?
All the lonely people
Where do they all belong?

Father McKenzie
Writing the words of a sermon that no one will hear
No one comes near
Look at him working
Darning his socks in the night when there's nobody there
What does he care?

All the lonely people
Where do they all come from?
All the lonely people
Where do they all belong?

Ah, look at all the lonely people
Ah, look at all the lonely people

Eleanor Rigby
Died in the church and was buried along with her name
Nobody came
Father McKenzie
Wiping the dirt from his hands as he walks from the grave
No one was saved

All the lonely people (
Ah, look at all the lonely people
)
Where do they all come from?
All the lonely people (
Ah, look at all the lonely people
)
Where do they all belong?",209
The Beatles,Something,The Beatles (The Original Studio Recordings),"Something in the way she moves
Attracts me like no other lover
Something in the way she woos me

I don't want to leave her now
You know I believe and how

Somewhere in her smile, she knows
That I don't need no other lover
Something in her style that shows me

I don't want to leave her now
You know I believe and how

You're asking me, will my love grow?
I don't know, I don't know
You stick around, now, it may show
I don't know, I don't know


Something in the way she knows
And all I have to do is think of her
Something in the things she shows me

I don't want to leave her now
You know I believe and how",127
The Beatles,Blackbird,The Beatles (The Original Studio Recordings),"Blackbird singing in the dead of night
Take these broken wings and learn to fly
All your life
You were only waiting for this moment to arise

Blackbird singing in the dead of night
Take these sunken eyes and learn to see
All your life
You were only waiting for this moment to be free

Blackbird fly, blackbird fly
Into the light of a dark black night
Blackbird fly, blackbird fly
Into the light of a dark black night

Blackbird singing in the dead of night
Take these broken wings and learn to fly
All your life
You were only waiting for this moment to arise

You were only waiting for this moment to arise
You were only waiting for this moment to arise",124
The Beatles,A Day in the Life,The Beatles (The Original Studio Recordings),"I read the news today, oh, boy
About a lucky man who made the grade
And though the news was rather sad
Well, I just had to laugh
I saw the photograph

He blew his mind out in a car
He didn't notice that the lights had changed
A crowd of people stood and stared
They'd seen his face before
Nobody was really sure if he was from the House of Lords

I saw a film today, oh, boy
The English Army had just won the war
A crowd of people turned away
But I just had to look
Having read the book

I'd love to turn you on

(One, two, three, four, five, six, seven, eight, nine, ten, eleven, twelve, thirteen, fourteen, fifteen, sixteen, seventeen, eighteen, nineteen, twenty, twenty-one, twenty-two, twenty-three, twenty-four)
(*Alarm clock rings*)
[Bridge: Paul McCartney, 
John Lennon & Paul McCartney
]
Woke up, fell out of bed
Dragged a comb across my head
Found my way downstairs and drank a cup
And looking up, I noticed I was late
Found my coat and grabbed my hat
Made the bus in seconds flat
Found my way upstairs and had a smoke
And somebody spoke and I went into a dream
Ah, ah-ah-ah
Ah-ah-ah, ah-ah-ah
Ah-ah-ah, ah, ah-ah-ah
Ah-ah-ah, ah-ah

I read the news today, oh, boy
Four thousand holes in Blackburn, Lancashire
And though the holes were rather small
They had to count them all
Now they know how many holes it takes to fill the Albert Hall

I'd love to turn you on

(One, two, three, four, five, six, seven, eight, nine, ten, eleven, twelve, thirteen, fourteen, fifteen, sixteen, seventeen, eighteen, nineteen, twenty, twenty-one, twenty-two, twenty-three, twenty-four)

(*Laughter*)
(…been so high)
(Never could be any other way) (Ba-ba-ba-ba-ba)",292
The Beatles,While My Guitar Gently Weeps,The Beatles (The Original Studio Recordings),"I look at you all, see the love there that's sleeping
While my guitar gently weeps
I look at the floor and I see it needs sweeping
Still, my guitar gently weeps

I don't know why nobody told you
How to unfold your love
I don't know how someone controlled you
They bought and sold you

I look at the world and I notice it's turning
While my guitar gently weeps
With every mistake, we must surely be learning
Still, my guitar gently weeps


I don't know how you were diverted
You were perverted, too
I don't know how you were inverted
No one alerted you

I look at you all, see the love there that's sleeping
While my guitar gently weeps
(I look) Look at you all
Still, my guitar gently weeps

Oh, oh
Oh, oh, oh, oh, oh, oh, oh
Oh, oh, oh, oh
Yeah, yeah, yeah, yeah, yeah
Yeah, yeah, yeah, yeah, oh, ooh",157
The Beatles,I Am the Walrus,The Beatles (The Original Studio Recordings),"I am he as you are he as you are me
And we are all together
See how they run like pigs from a gun
See how they fly, I'm cryin'

Sitting on a cornflake
Waiting for the van to come
Corporation tee-shirt, stupid bloody Tuesday
Man, you've been a naughty boy
You let your face grow long

I am the eggman
They are the eggmen
I am the walrus
Goo goo g'joob

Mister City policeman sitting
Pretty little policemen in a row
See how they fly like Lucy in the sky
See how they run, I'm cryin'
I'm cryin', I'm cryin', I'm cryin'

Yellow-matter custard
Dripping from a dead dog's eye
Crabalocker fishwife, pornographic priestess
Boy, you've been a naughty girl
You let your knickers down

I am the eggman
They are the eggmen
I am the walrus
Goo goo g'joob

Sitting in an English garden waiting for the sun
If the sun don't come, you get a tan
From standing in the English rain

I am the egg man (Now good sir, what are you?)
They are the egg men (A poor man, made tame to fortune's blows)
I am the walrus
Goo goo goo joob (Good pity)
G'goo goo g'joob

Expert, textpert, choking smokers
Don't you think the joker laughs at you?
(Ho ho ho, hee hee hee, ha ha ha)
See how they smile like pigs in a sty
See how they snied, I'm cryin'

Semolina pilchard
Climbing up the Eiffel Tower
Elementary penguin singing Hare Krishna
Man, you should have seen them
Kicking Edgar Allan Poe

I am the eggman
They are the eggmen
I am the walrus
Goo goo g'joob g'goo goo g'joob
Goo goo a'joob g'goo goo g'joob, g'goo
Joob! Joob! Joob!

Joob! Joob! Joob!
Joob! Joob! Joob! Joob! Joob!
Joob! Joob!
Joob! Joob!

Umpa, umpa, stick it up your jumper
Everybody's got one, everybody's got one
“Villain, take my Purse
If ever thou wilt thrive, bury my Body
And give the Letters which thou findst about me
To Edmund Earl of Gloucester: seek him out upon the English Party
Oh, untimely death, death–”
“I know thee well, a serviceable Villain; as duteous to the Vices of thy Mistress as badness would desire”
“What, is he dead?”
“Sit you down, Father; rest you”",380
The Beatles,"Ob-La-Di, Ob-La-Da",The Beatles (The Original Studio Recordings),"Desmond has a barrow in the marketplace
Molly is the singer in a band
Desmond says to Molly, “Girl, I like your face”
And Molly says this as she takes him by the hand

Ob-la-di, ob-la-da
Life goes on, brah
La-la, how the life goes on
Ob-la-di, ob-la-da
Life goes on, brah
La-la, how the life goes on

Desmond takes a trolley to the jeweler's store (Choo-choo-choo)
Buys a twenty-karat golden ring (Ring)
Takes it back to Molly waiting at the door
And as he gives it to her, she begins to sing (Sing)

Ob-la-di, ob-la-da (La-la-la-la-la-la-la-la)
Life goes on, brah (La-la-la-la-la)
La-la, how their life goes on
Ob-la-di, ob-la-da (La-la-la-la-la-la-la-la)
Life goes on, brah (La-la-la-la-la)
La-la, how their life goes on
Yeah (No)

In a couple of years, they have built a home, sweet home
With a couple of kids running in the yard
Of Desmond and Molly Jones (Ha, ha, ha, ha, ha, ha)

Happy ever after in the marketplace
Desmond lets the children lend a hand (Arm, leg)
Molly stays at home and does her pretty face
And in the evening, she still sings it with the band

Yes, ob-la-di, ob-la-da
Life goes on, brah
La-la, how the life goes on (Heh-heh)
Yeah, ob-la-di, ob-la-da
Life goes on, brah
La-la, how the life goes on

In a couple of years, they have built a home sweet home
With a couple of kids running in the yard
Of Desmond and Molly Jones (Ha, ha, ha, ha, ha, ha)
Yeah!

Happy ever after in the marketplace
Molly lets the children lend a hand (Foot)
Desmond stays at home and does his pretty face
And in the evening, she's a singer with the band

Yeah, ob-la-di, ob-la-da
Life goes on, brah
La-la, how the life goes on
Yeah, ob-la-di, ob-la-da
Life goes on, brah
La-la, how the life goes on

(Ha-ha-ha-ha) And if you want some fun (Ha-ha-ha-ha-ha)
Take Ob-la-di-bla-da
Ahh, thank you",323
The Beatles,Across the Universe,The Beatles (The Original Studio Recordings),"Words are flowing out like endless rain into a paper cup
They slither wildly as they slip away across the universe
Pools of sorrow, waves of joy are drifting through my opened mind
Possessing and caressing me

Jai Guru Deva, Om
Nothing's gonna change my world
Nothing's gonna change my world
Nothing's gonna change my world
Nothing's gonna change my world

Images of broken light which dance before me like a million eyes
They call me on and on across the universe
Thoughts meander like a restless wind inside a letter box
They tumble blindly as they make their way across the universe

Jai Guru Deva, Om
Nothing's gonna change my world
Nothing's gonna change my world
Nothing's gonna change my world
Nothing's gonna change my world

Sounds of laughter, shades of life are ringing through my open ears
Inciting and inviting me
Limitless undying love which shines around me like a million suns
It calls me on and on across the universe

Jai Guru Deva, Om
Nothing's gonna change my world
Nothing's gonna change my world
Nothing's gonna change my world
Nothing's gonna change my world

Jai Guru Deva
Jai Guru Deva
Jai Guru Deva
Jai Guru Deva
Jai Guru Deva
Jai Guru Deva",205
The Beatles,Strawberry Fields Forever,The Beatles (The Original Studio Recordings),"Let me take you down, 'cause I'm going to
Strawberry Fields
Nothing is real
And nothing to get hung about
Strawberry Fields forever

Living is easy with eyes closed
Misunderstanding all you see
It's getting hard to be someone, but it all works out
It doesn't matter much to me

Let me take you down, 'cause I'm going to
Strawberry Fields
Nothing is real
And nothing to get hung about
Strawberry Fields forever

No one, I think, is in my tree
I mean, it must be high or low
That is, you can't, you know, tune in, but it's all right
That is, I think it's not too bad

Let me take you down, 'cause I'm going to
Strawberry Fields
Nothing is real
And nothing to get hung about
Strawberry Fields forever
(Two, three, four, four)

Always, no, sometimes, think it's me
But you know, I know when it's a dream
I think I know, I mean—er—yes, but it's all wrong
That is, I think I disagree

Let me take you down, 'cause I'm going to
Strawberry Fields
Nothing is real
And nothing to get hung about
Strawberry Fields forever
Strawberry Fields forever
Strawberry Fields forever


Cranberry sauce, cranberry sauce",200
The Beatles,Yellow Submarine,The Beatles (The Original Studio Recordings),"In the town where I was born
Lived a man who sailed to sea
And he told us of his life
In the land of submarines

So we sailed on to the sun
Till we found the sea of green
And we lived beneath the waves
In our yellow submarine

We all live in a yellow submarine
Yellow submarine, yellow submarine
We all live in a yellow submarine
Yellow submarine, yellow submarine

And our friends are all aboard
Many more of them live next door
And the band begins to play

We all live in a yellow submarine
Yellow submarine, yellow submarine
We all live in a yellow submarine
Yellow submarine, yellow submarine

Full speed ahead, Mister Boatswain, full speed ahead
Full speed ahead it is, Sergeant
Cut the cable! Drop the cable!
Aye-aye, sir, aye-aye
Captain! Captain!

As we live a life of ease
Every one of us (
Every one of us
) has all we need (
Has all we need
)
Sky of blue (
Sky of blue
) and sea of green (
Sea of green
)
In our yellow (
In our yellow
) submarine (
Submarine, ha-ha!
)

We all live in a yellow submarine
Yellow submarine, yellow submarine
We all live in a yellow submarine
Yellow submarine, yellow submarine
We all live in a yellow submarine
Yellow submarine, yellow submarine
We all live in a yellow submarine
Yellow submarine, yellow submarine",239
The Beatles,With a Little Help from My Friends,The Beatles (The Original Studio Recordings),"Billy Shears!

What would you think if I sang out of tune?
Would you stand up and walk out on me?
Lend me your ears and I'll sing you a song
And I'll try not to sing out of key

Oh, I get by with a little help from my friends
Mm, I get high with a little help from my friends
Mm, gonna try with a little help from my friends
[Verse 2: Ringo Starr, 
John Lennon, Paul McCartney & George Harrison
]
What do I do when my love is away?
(Does it worry you to be alone?)
How do I feel by the end of the day?
(Are you sad because you're on your own?)

No, I get by with a little help from my friends
Mm, get high with a little help from my friends
Mm, I'm gonna try with a little help from my friends
[Bridge: Ringo Starr, 
John Lennon, Paul McCartney & George Harrison
]
Do you need anybody?
I need somebody to love
Could it be anybody?
I want somebody to love

Would you believe in a love at first sight?
Yes, I'm certain that it happens all the time
What do you see when you turn out the light?
I can't tell you, but I know it's mine

Oh, I get by with a little help from my friends
Mm, get high with a little help from my friends
Oh, I'm gonna try with a little help from my friends

Do you need anybody?
I just need someone to love
Could it be anybody?
I want somebody to love

Oh, I get by with a little help from my friends
Mm, gonna try with a little help from my friends
Oh, I get high with a little help from my friends
Yes, I get by with a little help from my friends
With a little help from my friends
(Ah-ah-ah-ah-ah-ah-ah-ah-ah)",318
The Beatles,Lucy in the Sky with Diamonds,The Beatles (The Original Studio Recordings),"Picture yourself in a boat on a river
With tangerine trees and marmalade skies
Somebody calls you, you answer quite slowly
A girl with kaleidoscope eyes

Cellophane flowers of yellow and green
Towering over your head
Look for the girl with the sun in her eyes
And she's gone

Lucy in the sky 
with diamonds
Lucy in the sky with diamonds
Lucy in the sky with diamonds
Ahh

Follow her down to a bridge by a fountain
Where rocking horse people eat marshmallow pies
Everyone smiles as you drift past the flowers
That grow so incredibly high (Ah)

Newspaper taxis appear on the shore
Waiting to take you away
Climb in the back with your head in the clouds
And you're gone

Lucy in the sky with diamonds
Lucy in the sky with diamonds
Lucy in the sky with diamonds
Ahh

Picture yourself on a train in a station
With plasticine porters with looking glass ties
Suddenly, someone is there at the turnstile
The girl with kaleidoscope eyes

Lucy in the sky with diamonds
Lucy in the sky with diamonds
Lucy in the sky with diamonds
Ahh
Lucy in the sky with diamonds
Lucy in the sky with diamonds
Lucy in the sky with diamonds
Ahh
Lucy in the sky with diamonds
Lucy in the sky with diamonds
Lucy in the sky with diamonds",224
The Beatles,Michelle,The Beatles (The Original Studio Recordings),"Michelle, ma belle (Ooh, ooh)
These are words that go together well (Ooh, ooh)
My Michelle (Ooh, ooh, ooh)

Michelle, ma belle (Ooh, ooh)
Sont des mots qui vont très bien ensemble (Ooh, ooh)
Très bien ensemble (Ooh, ooh, ooh)

I love you, I love you, I love you
That's all I want to say (Ooh, ooh)
Until I find a way (Ooh, ooh-ooh-ooh-ooh-ooh-ooh)
I will say the only words I know that you'll understand

Michelle, ma belle (Ooh, ooh)
Sont des mots qui vont très bien ensemble (Ooh, ooh)
Très bien ensemble (Ooh, ooh, ooh)

I need to, I need to, I need to (Ooh, ooh)
I need to make you see (Ooh, ooh)
Oh, what you mean to me (Ooh, ooh-ooh-ooh-ooh-ooh-ooh)
Until I do, I'm hoping you will know what I mean
I love you (Ooh, ooh)
(Ooh, ooh, ooh, ooh, ooh)


I want you, I want you, I want you
I think you know by now (Ooh, ooh)
I'll get to you somehow (Ooh, ooh-ooh-ooh-ooh-ooh-ooh)
Until I do, I'm telling you so you'll understand

Michelle, ma belle (Ooh, ooh)
Sont des mots qui vont très bien ensemble (Ooh, ooh)
Très bien ensemble (Ooh, ooh, ooh)

And I will say the only words I know that you'll understand
My Michelle (Mmm-mm-mm)",213
